name_product,price_product,sold_product,discount_product,link_product
"Giấy ăn Silkwell 250 tờ khổ 200, khăn giấy rút lụa siêu mềm mịn không tẩy trắng hàng chính hãng
Đã bán 27",16.000₫,Đã bán 27,-0%,https://tiki.vn/giay-an-silkwell-250-to-kho-200-khan-giay-rut-lua-sieu-mem-min-khong-tay-trang-hang-chinh-hang-p189688441.html?spid=189688442&i=279779
"10 Gói Khăn Rút Silkwell 250tờ/gói
Đã bán 6",175.000₫,Đã bán 6,-0%,https://tiki.vn/10-goi-khan-rut-silkwell-250to-goi-p189688449.html?spid=189688450&i=279779
"10 Gói Giấy Đa năng, lau bếp( lau tay) 100T Silkwell
Đã bán 13",130.000₫,Đã bán 13,-0%,https://tiki.vn/10-goi-giay-da-nang-lau-bep-lau-tay-100t-silkwell-p189688447.html?spid=189688448&i=279779
"Chai Xịt Thảo Mộc 10s Diệt Ruồi Muỗi Kiến Ba Khoang Gián Mối, 100% Sinh Học, An Toàn Cho Trẻ Em, Hiệu Quả Cao",85.000₫,,-0%,https://tiki.vn/chai-xit-thao-moc-10s-diet-ruoi-muoi-kien-ba-khoang-gian-moi-100-sinh-hoc-an-toan-cho-tre-em-hieu-qua-cao-p198541975.html?spid=198541977&i=293160
Túi rác có hương thơm tiện dụng Soji,39.000₫,,-0%,https://tiki.vn/tui-rac-co-huong-thom-tien-dung-soji-p195569877.html?spid=195569885&i=286853
"Bộ chổi & ky bầu Inochi
Đã bán 1",94.000₫,Đã bán 1,-0%,https://tiki.vn/bo-choi-ky-bau-inochi-p195104061.html?spid=195104067&i=286853
"Giấy lau đa năng Silkwell 100 tờ đặc biệt siêu dai, khăn lau bếp sạch dầu mỡ chuyên dụng hàng chính hãng
Đã bán 3",15.000₫,Đã bán 3,-0%,https://tiki.vn/giay-lau-da-nang-silkwell-100-to-dac-biet-sieu-dai-khan-lau-bep-sach-dau-mo-chuyen-dung-hang-chinh-hang-p189688429.html?spid=189688430&i=279779
"Khăn giấy ăn Silkwell 200 tờ 3 lớp dòng cao cấp siêu dai không mủn
Đã bán 23",18.500₫,Đã bán 23,-0%,https://tiki.vn/khan-giay-an-silkwell-200-to-3-lop-dong-cao-cap-sieu-dai-khong-mun-p189688479.html?spid=189688480&i=279779
Thùng rác nắp lật Hiro,139.000₫,,-0%,https://tiki.vn/thung-rac-nap-lat-hiro-p195568077.html?spid=195568081&i=286853
Bộ chổi & ky đa năng,144.000₫,,-0%,https://tiki.vn/bo-choi-ky-da-nang-p195202508.html?spid=195202509&i=286853
Lô túi rác tiện dụng Soji (4 cuộn/lô),79.000₫,,-0%,https://tiki.vn/lo-tui-rac-tien-dung-soji-4-cuon-lo-p195479004.html?spid=195479010&i=286853
Túi rác tiện dụng Soji,25.000₫,,-0%,https://tiki.vn/tui-rac-tien-dung-soji-p195569791.html?spid=195569797&i=286853
Lô túi rác màu tiện dụng Soji (4 cuộn/lô),89.000₫,,-0%,https://tiki.vn/lo-tui-rac-mau-tien-dung-soji-4-cuon-lo-p195478827.html?spid=195478833&i=286853
"Bộ cây lau nhà thông minh kèm thùng vắt 2 ngăn sizes trung BHM900
Đã bán 1",258.000₫,Đã bán 1,-0%,https://tiki.vn/bo-cay-lau-nha-thong-minh-kem-thung-vat-2-ngan-sizes-trung-bhm900-p195200530.html?spid=195200531&i=286853
Thùng rác đạp tròn Hiro,253.000₫,,-0%,https://tiki.vn/thung-rac-dap-tron-hiro-p195567814.html?spid=195567830&i=286853
"Hộp khử mùi, thơm phòng hương thảo mộc - 300g",48.000₫,,-0%,https://tiki.vn/hop-khu-mui-thom-phong-huong-thao-moc-300g-p191502067.html?spid=191502068&i=277662
Bột làm sạch lồng máy giặt cực mạnh Rocket - 120g,50.000₫,,-0%,https://tiki.vn/bot-lam-sach-long-may-giat-cuc-manh-rocket-120g-p191502123.html?spid=191502124&i=277662
Xịt thơm quần áo hương trái cây chai 380ml - Hàng Nhật nội địa- 380ml,55.000₫,,-0%,https://tiki.vn/xit-thom-quan-ao-huong-trai-cay-chai-380ml-hang-nhat-noi-dia-380ml-p191502065.html?spid=191502066&i=277662
Xịt thơm quần áo hương hoa trà chai 380ml - Hàng Nhật nội địa,55.000₫,,-0%,https://tiki.vn/xit-thom-quan-ao-huong-hoa-tra-chai-380ml-hang-nhat-noi-dia-p191502063.html?spid=191502064&i=277662
Kệ treo túi rác Hiro,59.000₫,,-0%,https://tiki.vn/ke-treo-tui-rac-hiro-p195453885.html?spid=195453889&i=286853
Nước tẩy lồng máy giặt siêu sạch - 550gr,58.000₫,,-0%,https://tiki.vn/nuoc-tay-long-may-giat-sieu-sach-550gr-p191502155.html?spid=191502156&i=277662
Xịt thơm và kháng khuẩn quần áo hương hoa 380ml - Hàng Nhật nội địa - 380ml,115.000₫,,-0%,https://tiki.vn/xit-thom-va-khang-khuan-quan-ao-huong-hoa-380ml-hang-nhat-noi-dia-380ml-p191502175.html?spid=191502176&i=277662
Hộp thơm phòng cao cấp hương chanh và bạc hà - 200g,65.000₫,,-0%,https://tiki.vn/hop-thom-phong-cao-cap-huong-chanh-va-bac-ha-200g-p191502105.html?spid=191502106&i=277662
Chai xịt tẩy rửa mảng bám siêu năng Rinrei- 330ml,145.000₫,,-0%,https://tiki.vn/chai-xit-tay-rua-mang-bam-sieu-nang-rinrei-330ml-p191502101.html?spid=191502102&i=277662
Bộ cây lau nhà tròn xoay 360 SM31,544.000₫,,-0%,https://tiki.vn/bo-cay-lau-nha-tron-xoay-360-sm31-p195201461.html?spid=195201462&i=286853
Tẩy lồng giặt Ultra (mẫu mới)- 550g,85.000₫,,-0%,https://tiki.vn/tay-long-giat-ultra-mau-moi-550g-p191502107.html?spid=191502108&i=277662
"Giấy ăn cân cao cấp Silkwell K240 Sếu mới siêu dai
Đã bán 3",50.000₫,Đã bán 3,-0%,https://tiki.vn/giay-an-can-cao-cap-silkwell-k240-seu-moi-sieu-dai-p189688497.html?spid=189688498&i=279779
Nước giặt đồ lót và tẩy các vết bẩn siêu mạnh KOSE 200ml chiết xuất từ thiên nhiên - Hàng Nhật nội địa -200ml,135.000₫,,-0%,https://tiki.vn/nuoc-giat-do-lot-va-tay-cac-vet-ban-sieu-manh-kose-200ml-chiet-xuat-tu-thien-nhien-hang-nhat-noi-dia-200ml-p191502056.html?spid=191502058&i=277662
Hộp thơm phòng cao cấp hương đào - 200g,65.000₫,,-0%,https://tiki.vn/hop-thom-phong-cao-cap-huong-dao-200g-p191502205.html?spid=191502206&i=277662
Chai xịt vệ sinh bồn cầu 300ml Rocket- Hàng Nhật nội địa- 300ml,45.000₫,,-0%,https://tiki.vn/chai-xit-ve-sinh-bon-cau-300ml-rocket-hang-nhat-noi-dia-300ml-p191502077.html?spid=191502079&i=277662
"Bộ cây lau nhà thông minh kèm thùng vắt 2 ngăn sizes lớn BHM200
Đã bán 1",440.000₫,Đã bán 1,-0%,https://tiki.vn/bo-cay-lau-nha-thong-minh-kem-thung-vat-2-ngan-sizes-lon-bhm200-p195194356.html?spid=195194357&i=286853
Nước rửa tay tạo bọt Biore 230ml diệt khuẩn virus- Hàng Nhật nội địa - 230ml,120.000₫,,-0%,https://tiki.vn/nuoc-rua-tay-tao-bot-biore-230ml-diet-khuan-virus-hang-nhat-noi-dia-230ml-p191502137.html?spid=191502138&i=277662
Nước rửa tay Lion hoa hồng 250ml diệt khuẩn hương hoa hồng - 250ml,115.000₫,,-0%,https://tiki.vn/nuoc-rua-tay-lion-hoa-hong-250ml-diet-khuan-huong-hoa-hong-250ml-p191502173.html?spid=191502174&i=277662
Bột tẩy đa năng baking soda mã mới- 240g,39.000₫,,-0%,https://tiki.vn/bot-tay-da-nang-baking-soda-ma-moi-240g-p191502055.html?spid=191502057&i=277662
Bộ cây lau nhà tự vắt MOPZ9,485.000₫,,-0%,https://tiki.vn/bo-cay-lau-nha-tu-vat-mopz9-p195201776.html?spid=195201777&i=286853
"Chai xịt diệt gián, côn trùng không mùi",145.000₫,,-0%,https://tiki.vn/chai-xit-diet-gian-con-trung-khong-mui-p191502125.html?spid=191502126&i=277662
Xịt thơm quần áo hương hoa hồng dạng túi 450ml - Hàng Nhật nội địa - 450,45.000₫,,-0%,https://tiki.vn/xit-thom-quan-ao-huong-hoa-hong-dang-tui-450ml-hang-nhat-noi-dia-450-p191502073.html?spid=191502074&i=277662
Chai xịt tẩy rửa đồ dùng nhà bếp 300ml Rocket - Hàng Nhật nội địa - 300ml,45.000₫,,-0%,https://tiki.vn/chai-xit-tay-rua-do-dung-nha-bep-300ml-rocket-hang-nhat-noi-dia-300ml-p191502075.html?spid=191502076&i=277662
Nước rửa tay Lion 250ml,115.000₫,,-0%,https://tiki.vn/nuoc-rua-tay-lion-250ml-p191502163.html?spid=191502164&i=277662
Hộp thơm phòng hương hoa hồng- Hàng Nhật nội địa - 200ml,45.000₫,,-0%,https://tiki.vn/hop-thom-phong-huong-hoa-hong-hang-nhat-noi-dia-200ml-p191502051.html?spid=191502053&i=277662
