name_product,price_product,sold_product,discount_product,link_product
Bộ 02 thìa tập ăn Amori,34.000₫,,-0%,https://tiki.vn/bo-02-thia-tap-an-amori-p195113129.html?spid=195113130&i=286853
Bô trẻ em Notoro,39.000₫,,-0%,https://tiki.vn/bo-tre-em-notoro-p195231369.html?spid=195231375&i=286853
"Bình nước Goki Hero 350 ml
Đã bán 1",159.000₫,Đã bán 1,-0%,https://tiki.vn/binh-nuoc-goki-hero-350-ml-p194965419.html?spid=194965421&i=286853
Bộ đồ ăn dặm trẻ em Amori,279.000₫,,-0%,https://tiki.vn/bo-do-an-dam-tre-em-amori-p195202616.html?spid=195202617&i=286853
Khay trữ đông đồ ăn dặm Amori,46.000₫,,-0%,https://tiki.vn/khay-tru-dong-do-an-dam-amori-p195478277.html?spid=195478278&i=286853
Kun nước trái cây chua chua ngọt ngọt Thùng 24 túix110ml,119.782₫,,-0%,https://tiki.vn/kun-_-ntc-chua-chua-ngot-ngot-thung-24-tuix110ml-p205719956.html?spid=205719961&i=302551
"Kun sữa chua uống vị cam thùng 24 túi x 110ml
Đã bán 6",119.782₫,Đã bán 6,-0%,https://tiki.vn/kun_sua-chua-uong-vi-cam-thung-24-tui-x-110ml-p205719944.html?spid=205719945&i=302551
Nước rửa bình sữa Combi chai 300ml túi 250ml,125.000₫,,-0%,https://tiki.vn/nuoc-rua-binh-sua-combi-chai-300ml-tui-250ml-p208318629.html?spid=208318631&i=302493
Túi dung dịch rửa bình sữa và rau quả Combi 112579 250ml,126.150₫,,-0%,https://tiki.vn/tui-dung-dich-rua-binh-sua-va-rau-qua-combi-112579-250ml-p208318741.html?spid=208318745&i=302493
"Kun sữa trái cây hương cam thùng 48 hộp x 180ml
Đã bán 1",331.855₫,Đã bán 1,-0%,https://tiki.vn/kun_sua-trai-cay-huong-cam-thung-48-hop-x-180ml-p205719938.html?spid=205719939&i=302551
"Kun sữa chua uống hương dâu thùng 24 túi x 110ml
Đã bán 3",119.782₫,Đã bán 3,-0%,https://tiki.vn/kun_sua-chua-uong-huong-dau-thung-24-tui-x-110ml-p205720022.html?spid=205720023&i=302551
Bình sữa Philips Avent Natural bằng nhựa không có BPA 125ml 690.13,221.000₫,,-0%,https://tiki.vn/binh-sua-philips-avent-natural-bang-nhua-khong-co-bpa-125ml-690-13-p208318187.html?spid=208318192&i=302493
Móc áo cho trẻ em Hara 188,49.000₫,,-0%,https://tiki.vn/moc-ao-cho-tre-em-hara-188-p195520008.html?spid=195520016&i=286853
Set 3 khăn sữa sợi tre siêu mềm Muslin tree 28x28cm,50.000₫,,-0%,https://tiki.vn/set-3-khan-sua-soi-tre-sieu-mem-muslin-tree-28x28cm-p208319077.html?spid=208319082&i=302493
Hộp 200 que tăm bông Nuk cotton / cotton slim,52.000₫,,-0%,https://tiki.vn/hop-200-que-tam-bong-nuk-cotton-cotton-slim-p208318975.html?spid=208318988&i=302493
Que Cọ Rửa Ống Hút 20cm thép không rỉ que cọ rửa vệ sinh ống hút cao cấp,9.000₫,,-0%,https://tiki.vn/que-co-rua-ong-hut-20cm-thep-khong-ri-que-co-rua-ve-sinh-ong-hut-cao-cap-p208317980.html?spid=208317982&i=302493
bộ bát thìa ăn dặm ND Richell,159.200₫,,-0%,https://tiki.vn/bo-bat-thia-an-dam-nd-richell-p208318419.html?spid=208318423&i=302493
"INOCHI Bộ 4 Hộp Đựng Thực Phẩm Hokkaido nhựa nguyên sinh kháng khuẩn, không mùi dùng trong lò vi sóng nhiều hình dạng",119.000₫,,-0%,https://tiki.vn/inochi-bo-4-hop-dung-thuc-pham-hokkaido-nhua-nguyen-sinh-khang-khuan-khong-mui-dung-trong-lo-vi-song-nhieu-hinh-dang-p208317768.html?spid=208317789&i=302493
Bộ 2 sách vải cho bé chơi mà học Pipo - Sinh vật biển và động vật ăn thịt,90.000₫,,-0%,https://tiki.vn/bo-2-sach-vai-cho-be-choi-ma-hoc-pipo-sinh-vat-bien-va-dong-vat-an-thit-p208318875.html?spid=208318877&i=302493
Đồ chơi chuông hình mèo con Toyroyal 3222,85.000₫,,-0%,https://tiki.vn/do-choi-chuong-hinh-meo-con-toyroyal-3222-p208317946.html?spid=208317949&i=302493
"Chăn ủ xô nhăn 4 lớp có mũ, có tai Mipbi 70x70cm",190.000₫,,-0%,https://tiki.vn/chan-u-xo-nhan-4-lop-co-mu-co-tai-mipbi-70x70cm-p208319001.html?spid=208319018&i=302493
Mũ len lót nỉ siêu mềm ấm hàng xuất dư cao cấp chất lượng vượt trội cho bé 1-4 tuổi,182.000₫,,-0%,https://tiki.vn/mu-len-lot-ni-sieu-mem-am-hang-xuat-du-cao-cap-chat-luong-vuot-troi-cho-be-1-4-tuoi-p208317505.html?spid=208317512&i=302493
Khăn thấm mồ hôi lưng xuất Nhật 5 lớp 21x25 cm,29.000₫,,-0%,https://tiki.vn/khan-tham-mo-hoi-lung-xuat-nhat-5-lop-21x25-cm-p208318220.html?spid=208318269&i=302493
Đồ chơi Luồn thun Robo Winwintoys 60052,88.000₫,,-0%,https://tiki.vn/do-choi-luon-thun-robo-winwintoys-60052-p208318978.html?spid=208318986&i=302493
Đồ chơi xe rác Winwintoys 63292,190.000₫,,-0%,https://tiki.vn/do-choi-xe-rac-winwintoys-63292-p208319342.html?spid=208319344&i=302493
"Gia vị rắc cơm, cháo cho bé 6 vị 30 gói nhỏ (75g)",70.000₫,,-0%,https://tiki.vn/gia-vi-rac-com-chao-cho-be-6-vi-30-goi-nho-75g-p208319130.html?spid=208319135&i=302493
Khối Rubik vải phát nhạc Combi 11020,675.000₫,,-0%,https://tiki.vn/khoi-rubik-vai-phat-nhac-combi-11020-p208319358.html?spid=208319359&i=302493
"Gối Lót Đầu Điều Hòa Cho Bé Xuất Hàn Có Viền, Thoáng Mát Sử Dụng Được 4 Mùa Cho Trẻ Từ Sơ Sinh Đến 4 Tuổi 25x45 cm",120.000₫,,-0%,https://tiki.vn/goi-lot-dau-dieu-hoa-cho-be-xuat-han-co-vien-thoang-mat-su-dung-duoc-4-mua-cho-tre-tu-so-sinh-den-4-tuoi-25x45-cm-p208318025.html?spid=208318046&i=302493
Sách vải cho bé chơi mà học Pipo - Chữ cái tiếng Việt,46.000₫,,-0%,https://tiki.vn/sach-vai-cho-be-choi-ma-hoc-pipo-chu-cai-tieng-viet-p208318951.html?spid=208318952&i=302493
Khăn ủ 1 lớp 2 lớp sơ sinh Mipbi,89.000₫,,-0%,https://tiki.vn/khan-u-1-lop-2-lop-so-sinh-mipbi-p208317991.html?spid=208318003&i=302493
"Kun sữa trái cây hương nho thùng 24 túi x 110ml
Đã bán 3",119.782₫,Đã bán 3,-0%,https://tiki.vn/kun_sua-trai-cay-huong-nho-thung-24-tui-x-110ml-p205719989.html?spid=205719991&i=302551
Kun sữa chua uống hương cam thùng 48 hộp x110ml,225.818₫,,-0%,https://tiki.vn/kun_sua-chua-uong-huong-cam-thung-48-hop-x110ml-p205719975.html?spid=205719981&i=302551
Kun sữa trái cây nhiệt đới thùng 48 hộp x 110ml,206.182₫,,-0%,https://tiki.vn/kun_sua-trai-cay-nhiet-doi-thung-48-hop-x-110ml-p205719994.html?spid=205719997&i=302551
"Kun thức uống dinh dưỡng vị Sôcôla lúa mạch thùng 24 túi x 110ml
Đã bán 2",119.782₫,Đã bán 2,-0%,https://tiki.vn/kun_thuc-uong-dinh-duong-vi-socola-lua-mach-thung-24-tui-x-110ml-p205719948.html?spid=205719951&i=302551
Kun sữa chua Uống hương kem dâu thùng 48 chai x 85ml,198.327₫,,-0%,https://tiki.vn/kun_sua-chua-uong-huong-kem-dau-thung-48-chai-x-90ml-p205719968.html?spid=205719970&i=302551
"Kun sữa chua uống kem dâu thùng 48 hộp x 180ml
Đã bán 2",358.364₫,Đã bán 2,-0%,https://tiki.vn/kun_sua-chua-uong-kem-dau-thung-48-hop-x-180ml-p205719971.html?spid=205719973&i=302551
"KUN sữa Sôcôla lúa mạch thùng 48 hộp x110ml
Đã bán 1",230.727₫,Đã bán 1,-0%,https://tiki.vn/kun_sua-socola-lua-mach-thung-48-hop-x110ml-p205720034.html?spid=205720035&i=302551
"Kun thức uống dinh dưỡng vị Sôcôla lúa mạch thùng 48 hộp x 180ml
Đã bán 3",363.273₫,Đã bán 3,-0%,https://tiki.vn/kun_thuc-uong-dinh-duong-vi-socola-lua-mach-thung-48-hop-x-180ml-p205719940.html?spid=205719941&i=302551
Khăn Yếm Xô Organic 2in1 phong cách Hàn Quốc Vừa là Khăn mặt vừa làm yếm cho bé kích thước 25x25cm,29.000₫,,-0%,https://tiki.vn/khan-yem-xo-organic-2in1-phong-cach-han-quoc-vua-la-khan-mat-vua-lam-yem-cho-be-kich-thuoc-25x25cm-p208317634.html?spid=208317640&i=302493
Áo choàng tắm trẻ em Poemy cao cấp siêu mềm mịn cho bé 5-12 tuổi,474.050₫,,-0%,https://tiki.vn/ao-choang-tam-tre-em-poemy-cao-cap-sieu-mem-min-cho-be-5-12-tuoi-p208318662.html?spid=208318682&i=302493
